{"schema_version":"1.0.0","target_id":"figma","source_url":"https://figma.com","captured_at":"2026-05-21T11:47:17.931Z","freshness":"historical_snapshot_live_revalidation_pending","backend":"designlang","state":{"brand_personality":["flat material","friendly voice","you-only pronoun posture"],"color_system":{"primary":"#e4ff97","secondary":"#00b6ff","accent":"#c4baff","background":"#ffffff"},"typography":{"primary_font":"figmaSans","mono_font":"figmaMono","heading_style":{"h1":"64px / 400"},"body_style":{"size":"18px"}},"layout_language":{"grid":"23 grid / 154 flex","section_style":"landing"},"component_patterns":["badges","buttons","cards","dropdowns","footer","links","modals","navigation","tabs"]},"coverage":["brand_personality","color_system","component_patterns","layout_language","typography"],"fingerprint":"fb71c631f858b19853400c4944ffa41626605d75cde5afa1f5f03b77e80ed94a","evidence":{"source_repo":"Manavarya09/design-extract","source_blob_sha":"0a72296d1f52e87d5e5d57db682d10f2194d5873"}}
