{"schema_version":"1.0.0","target_id":"raycast","source_url":"https://raycast.com","captured_at":"2026-06-25T08:25:22.082Z","freshness":"historical_snapshot_live_revalidation_pending","backend":"designlang","state":{"brand_personality":["flat material","neutral voice","third-person pronoun posture"],"color_system":{"primary":"#ff6363","secondary":"#8cd6ff","accent":"#56c2ff","background":"#07080a"},"typography":{"primary_font":"Inter","mono_font":"GeistMono","heading_style":{"h1":"64px / 600"},"body_style":{"size":"16px"}},"layout_language":{"grid":"334 grid / 839 flex","section_style":"landing"},"component_patterns":["avatars","badges","buttons","cards","dropdowns","footer","inputs","links","navigation","switches","tables","tooltips"]},"coverage":["brand_personality","color_system","component_patterns","layout_language","typography"],"fingerprint":"0bf9a4672883626052a904f4de381e6a9cd81f942e4bd8e5082e3070303cce53","evidence":{"source_repo":"Manavarya09/design-extract","source_blob_sha":"21c759268e6ab8f17dca010a1cea90a4fd8a9d86"}}
