{"schema_version":"1.0.0","target_id":"vercel","source_url":"https://vercel.com","captured_at":"2026-05-21T11:46:57.594Z","freshness":"historical_snapshot_live_revalidation_pending","backend":"designlang","state":{"brand_personality":["material-you material","neutral voice","you-only pronoun posture"],"color_system":{"primary":"#0068d6","secondary":"#52aeff","accent":"#0070f3","background":"#fafafa"},"typography":{"primary_font":"Geist","heading_style":{"h1":"48px / 600"},"body_style":{"size":"16px"},"mono_font":"Geist Mono"},"layout_language":{"grid":"56 grid / 500 flex","section_style":"landing"},"component_patterns":["badges","buttons","cards","dropdowns","footer","inputs","links","navigation","switches","tabs","tooltips"],"design_patterns":[{"name":"flex-dominant layout with grid support","category":"layout","abstraction":"semantic","confidence":0.92},{"name":"large display type over compact body scale","category":"typography","abstraction":"semantic","confidence":0.92},{"name":"neutral second-person marketing voice","category":"voice","abstraction":"semantic","confidence":0.95},{"name":"primary sans with utility mono","category":"typography","confidence":0.9},{"name":"radius scale spans subtle corners to pill controls","category":"shape","abstraction":"semantic","confidence":0.95}]},"coverage":["brand_personality","color_system","component_patterns","design_patterns","layout_language","typography"],"fingerprint":"711f3cb8f09f1d48957241d6d4b9742f5cfc0cdd66d38490676d2d01a6eb524a","evidence":{"source_repo":"Manavarya09/design-extract","source_blob_sha":"f23f560b495c00dd8728179fc80c7a43f993e821","dna_git_blob_sha":"80c4acdd394021c1dbed54576a49a1d51d1ca55f"}}
