{"schema_version":"1.0.0","target_id":"linear","source_url":"https://linear.app","captured_at":"2026-05-21T11:46:56.723Z","freshness":"historical_snapshot_live_revalidation_pending","backend":"designlang","state":{"brand_personality":["material-you material","neutral voice","you-only pronoun posture"],"color_system":{"primary":"#e4f222","secondary":"#5e6ad2","accent":"#00ff05","background":"#08090a"},"typography":{"primary_font":"Inter Variable","heading_style":{"h1":"64px / 510"},"body_style":{"size":"14px"},"mono_font":"Berkeley Mono"},"layout_language":{"grid":"98 grid / 495 flex","section_style":"landing"},"component_patterns":["avatars","badges","buttons","cards","dropdowns","footer","inputs","links","navigation","switches"],"design_patterns":[{"name":"flex-dominant layout with grid support","category":"layout","abstraction":"semantic","confidence":0.92},{"name":"large display type over compact body scale","category":"typography","abstraction":"semantic","confidence":0.92},{"name":"neutral second-person marketing voice","category":"voice","abstraction":"semantic","confidence":0.95},{"name":"primary sans with utility mono","category":"typography","confidence":0.9},{"name":"radius scale spans subtle corners to pill controls","category":"shape","abstraction":"semantic","confidence":0.95}]},"coverage":["brand_personality","color_system","component_patterns","design_patterns","layout_language","typography"],"fingerprint":"4bfc173f27cb7a1d51d7d286b6ee1e0d4cf5f0598fe3dda922baf680dd87cda1","evidence":{"source_repo":"Manavarya09/design-extract","source_blob_sha":"9aad83bc32721d5741e2ee3b9e596a1979e7a82f","dna_git_blob_sha":"9356af5cb9c30640fda3c59d7acdfdddd1ffa22f"}}
