{"schema_version":"1.0.0","target_id":"apple","source_url":"https://apple.com","captured_at":"2026-05-21T11:46:59.384Z","freshness":"historical_snapshot_live_revalidation_pending","backend":"designlang","state":{"brand_personality":["friendly voice","material-you material","you-only pronoun posture"],"color_system":{"primary":"#f5f5f7","secondary":"#0071e3","accent":"#ea33c0","background":"#ffffff"},"typography":{"primary_font":"SF Pro Text","display_font":"SF Pro Display","heading_style":{"h1":"56px / 600"},"body_style":{"size":"12px"}},"layout_language":{"grid":"29 grid / 208 flex","section_style":"landing"},"component_patterns":["buttons","dropdowns","footer","inputs","links","navigation","progressBars","tabs"]},"coverage":["brand_personality","color_system","component_patterns","layout_language","typography"],"fingerprint":"83df4d8cf4f3719e1db71b26c4fe866329b2940c659653e6f4c9b6c0e8f9648d","evidence":{"source_repo":"Manavarya09/design-extract","source_blob_sha":"2e347f09bfa90b80533a769b635157ce35a4c3bd"}}
