{"schema_version":"1.0.0","target_id":"stripe","source_url":"https://stripe.com","captured_at":"2026-05-21T11:46:59.896Z","freshness":"historical_snapshot_live_revalidation_pending","backend":"designlang","state":{"brand_personality":["flat material","neutral voice","you-only pronoun posture"],"color_system":{"primary":"#533afd","secondary":"#e5edf5","accent":"#ffe0d1","background":"#ffffff"},"typography":{"primary_font":"sohne-var","heading_style":{"h1":"56px / 300"},"body_style":{"size":"16px"}},"layout_language":{"grid":"53 grid / 374 flex","section_style":"landing"},"component_patterns":["badges","buttons","cards","dropdowns","footer","links","modals","navigation","progressBars","switches"],"design_patterns":[{"name":"flex-dominant layout with grid support","category":"layout","abstraction":"semantic","confidence":0.92},{"name":"large display type over compact body scale","category":"typography","abstraction":"semantic","confidence":0.92},{"name":"neutral second-person marketing voice","category":"voice","abstraction":"semantic","confidence":0.95},{"name":"radius scale spans subtle corners to pill controls","category":"shape","abstraction":"semantic","confidence":0.95}]},"coverage":["brand_personality","color_system","component_patterns","design_patterns","layout_language","typography"],"fingerprint":"1296861f2e55fbeee0477f3cdd7574168a88141c957905483cc7f1bf7c3961df","evidence":{"source_repo":"Manavarya09/design-extract","source_blob_sha":"cfee6055909b6bd84c1b9fae4ff20dc4dd0d74bf","dna_git_blob_sha":"adc270dc66a0015383f77bd307362613bf18cb7e"}}
